{
  "$schema": "https://json-schema.org/draft/2020-12/schema",
  "$id": "urn:s1:schema:event",
  "title": "사건 카드",
  "type": "object",
  "properties": {
    "id": {
      "$ref": "urn:s1:schema:common#/$defs/id"
    },
    "stage": {
      "type": "string",
      "enum": [
        "s1a",
        "s1b",
        "s1c"
      ]
    },
    "phase": {
      "type": "string",
      "enum": [
        "travel",
        "stop",
        "council",
        "settle"
      ]
    },
    "trigger": {
      "$ref": "urn:s1:schema:common#/$defs/conditions"
    },
    "speaker": {
      "type": "string",
      "enum": [
        "captain",
        "deputy",
        "ration_officer",
        "rep",
        "aide",
        "faction_leader",
        "tail",
        "engine",
        "guard",
        "medtech",
        "front"
      ]
    },
    "body": {
      "type": "string",
      "minLength": 1,
      "maxLength": 120
    },
    "choices": {
      "type": "array",
      "items": {
        "type": "object",
        "properties": {
          "id": {
            "type": "string",
            "pattern": "^c_[a-z0-9_]+$",
            "description": "선택지 id. 번역 키 <사건 id>.<선택지 id>.<필드>에 쓴다(6.2). 순번 대신 쓴다."
          },
          "label": {
            "type": "string",
            "minLength": 1,
            "maxLength": 15,
            "pattern": "^[^\\r\\n]+$",
            "description": "무엇을 하는지 짧게. 일지에 남는다."
          },
          "say": {
            "type": "string",
            "minLength": 1,
            "maxLength": 40,
            "pattern": "^[^\\r\\n]+$",
            "description": "카드에 보이는 열차장의 말. 한두 문장. 효과와 비용은 넣지 않는다(2026-10-07 사용자)."
          },
          "log": {
            "type": "string",
            "minLength": 1,
            "maxLength": 40,
            "pattern": "^[^\\s][^\\r\\n]*$",
            "description": "고른 뒤 일지에 남는 지난 일 한 줄. 없으면 「제목: 라벨.」이 남는다."
          },
          "why": {
            "type": "string",
            "maxLength": 100,
            "pattern": "^[^\r\n]*$",
            "description": "그 칸의 사정 한 줄(까닭). 이 선택지 값이 왜 그렇게 나오는지 그 칸 사람과 물건으로 말한다. 40~60자, 70자를 넘기면 경고. 없거나 비면 경고."
          },
          "later": {
            "type": "string",
            "maxLength": 100,
            "pattern": "^[^\r\n]+$",
            "description": "나중에 이 선택이 무엇으로 돌아오는지 한 줄. 후속 카드가 있거나 뒤에서 읽는 표식을 세우는 선택지에만 쓴다."
          },
          "requires": {
            "type": "array",
            "description": "자원이 모자라면 이 선택지를 카드에서 숨긴다(모두 참일 때만 보인다). 숨길 선택지만 거르고, 다 숨어야 하면 숨기지 않는다.",
            "items": {
              "$ref": "urn:s1:schema:common#/$defs/resourceCondition"
            },
            "minItems": 1
          },
          "effects": {
            "$ref": "urn:s1:schema:effects#/$defs/list"
          },
          "followups": {
            "$ref": "urn:s1:schema:common#/$defs/references"
          },
          "witnesses": {
            "type": "array",
            "items": {
              "$ref": "urn:s1:schema:common#/$defs/witness"
            },
            "minItems": 0
          }
        },
        "required": [
          "id",
          "label",
          "effects",
          "followups",
          "witnesses"
        ],
        "additionalProperties": false
      },
      "minItems": 2,
      "maxItems": 4
    },
    "repeat": {
      "type": "integer",
      "minimum": 0
    },
    "chronicle": {
      "$ref": "urn:s1:schema:common#/$defs/id"
    },
    "content_type": {
      "const": "event"
    },
    "params": {
      "$ref": "urn:s1:schema:common#/$defs/textParams"
    },
    "plural": {
      "$ref": "urn:s1:schema:common#/$defs/textPlural"
    },
    "gender_of": {
      "$ref": "urn:s1:schema:common#/$defs/textGender"
    },
    "notes": {
      "$ref": "urn:s1:schema:common#/$defs/textNotes"
    },
    "bind": {
      "type": "object",
      "description": "자리표시자 값을 어디서 가져올지(s1_content_guide 6.9 표). car·item·n·n2를 쓰면 반드시 적는다.",
      "properties": {
        "person": {
          "type": "string",
          "pattern": "^(community:(tail|engine|guard|medtech|front)|role:[^\\s:][^:]*|witness|scapegoat)$"
        },
        "person2": {
          "type": "string",
          "pattern": "^(community:(tail|engine|guard|medtech|front)|role:[^\\s:][^:]*|witness|scapegoat)$"
        },
        "community": {
          "type": "string",
          "pattern": "^(tail|engine|guard|medtech|front|lowest_relation|highest_tension)$"
        },
        "law": {
          "type": "string",
          "pattern": "^(law:[a-z][a-z0-9_]*|last_repealed)$"
        },
        "place": {
          "type": "string",
          "enum": [
            "last_stop",
            "next_stop"
          ]
        },
        "car": {
          "type": "string",
          "pattern": "^car:(tail|engine|guard|medtech|front)$"
        },
        "item": {
          "type": "string",
          "pattern": "^(last_symbol|resource:(coal|food|medicine|luxury|symbol))$"
        },
        "n": {
          "type": "string",
          "pattern": "^(food_shortfall|coal_left|food_left|dead_last_segment|injured|away|pop:(tail|engine|guard|medtech|front))$"
        },
        "n2": {
          "type": "string",
          "pattern": "^(food_shortfall|coal_left|food_left|dead_last_segment|injured|away|pop:(tail|engine|guard|medtech|front))$"
        }
      },
      "additionalProperties": false
    },
    "community": {
      "description": "speaker가 rep·aide일 때 말하는 공동체. any면 조건을 만족하는 공동체 중 하나(6.9).",
      "anyOf": [
        {
          "$ref": "urn:s1:schema:common#/$defs/community"
        },
        {
          "const": "any"
        }
      ]
    },
    "faction": {
      "description": "speaker가 faction_leader일 때 세력 id(S1b). 세력이 없는 S1a는 이 사건을 뽑지 않는다.",
      "$ref": "urn:s1:schema:common#/$defs/id"
    }
  },
  "required": [
    "id",
    "stage",
    "phase",
    "trigger",
    "speaker",
    "body",
    "choices",
    "repeat"
  ],
  "additionalProperties": false
}
