{
  "id": "ev_h10_aide_night",
  "content_type": "event",
  "stage": "s1a",
  "phase": "travel",
  "trigger": [
    {
      "type": "flag",
      "id": "h10_pending",
      "value": true
    },
    {
      "type": "resource",
      "resource": "medicine",
      "operator": "gte",
      "value": 35
    }
  ],
  "speaker": "aide",
  "community": "medtech",
  "body": "조수가 밤을 넘겼다. 저울 옆에 적어 둔 눈금이 아침까지 그대로다. \"한 번 다시 잰 것 말고는 없습니다.\"",
  "choices": [
    {
      "id": "c_make_shift",
      "label": "조수를 교대에 넣는다",
      "log": "밤샘한 조수를 의무칸 교대에 넣기로 했다.",
      "say": "조수를 밤 교대에 넣어라. 의무장은 하루 걸러 잔다.",
      "why": "조수 몫 등과 담요가 창고에서 하나 더 나간다. 의무장이 하루 걸러 눕는 자리가 생긴다.",
      "effects": [
        {
          "type": "luxury",
          "amount": -2
        },
        {
          "type": "flag",
          "id": "h10_pending",
          "value": false
        },
        {
          "type": "flag",
          "id": "ev_achieved",
          "value": true
        }
      ],
      "followups": [],
      "witnesses": []
    },
    {
      "id": "c_this_once",
      "label": "이번만으로 한다",
      "log": "조수의 의무칸 밤샘은 이번만으로 정했다.",
      "say": "이번만이다. 다음 밤은 의무장이 본다.",
      "why": "밤을 넘긴 조수는 다음 밤 다시 저울 옆에 못 선다. 의무장은 \"조건을 말씀드렸는데\"라고만 한다.",
      "effects": [
        {
          "type": "relation",
          "target": "medtech",
          "amount": -3
        },
        {
          "type": "flag",
          "id": "h10_pending",
          "value": false
        }
      ],
      "followups": [],
      "witnesses": []
    }
  ],
  "repeat": 0
}
