{
  "id": "ev_b01_frozen_switch",
  "content_type": "event",
  "stage": "s1a",
  "phase": "travel",
  "trigger": [
    {
      "type": "segment",
      "min": 3,
      "max": 20
    }
  ],
  "speaker": "engine",
  "body": "이름 없는 들판의 분기기가 얼어 붙었습니다. 선로 갈래를 움직일 수 없어 얼음부터 걷어 내야 합니다.",
  "choices": [
    {
      "id": "c_clear",
      "label": "분기기 얼음을 걷는다",
      "say": "끌과 망치를 가져와라. 틈의 얼음을 걷어 낸다.",
      "effects": [
        {
          "type": "food",
          "amount": -3
        },
        {
          "type": "coal",
          "amount": -2
        }
      ],
      "followups": [],
      "witnesses": []
    },
    {
      "id": "c_guard_clear",
      "label": "경비칸에 얼음을 맡긴다",
      "say": "경비칸이 얼음을 걷어라. 선로 갈래를 확인한다.",
      "effects": [
        {
          "type": "community.exposure",
          "target": "guard",
          "amount": 6
        },
        {
          "type": "relation",
          "target": "guard",
          "amount": -4
        }
      ],
      "followups": [],
      "witnesses": []
    }
  ],
  "repeat": 0
}
