{
  "id": "ev_b01_wobbly_cart",
  "content_type": "event",
  "stage": "s1a",
  "phase": "travel",
  "trigger": [
    {
      "type": "segment",
      "min": 4,
      "max": 20
    },
    {
      "type": "community",
      "community": "front",
      "metric": "crowding",
      "operator": "gte",
      "value": 55
    }
  ],
  "speaker": "front",
  "body": "객차 안에서 쓰는 작은 손수레의 바퀴가 흔들린다. 짐을 밀던 사람이 손잡이를 놓고 바닥에 앉았다.",
  "choices": [
    {
      "id": "c_repair",
      "label": "바퀴를 손본다",
      "say": "손수레를 받쳐라. 축이 흔들리는 곳을 보자.",
      "why": "축에 끼울 쐐기와 기름이 창고에서 나간다. 바퀴가 서면 짐이 다시 굴러간다.",
      "effects": [
        {
          "type": "luxury",
          "amount": -3
        }
      ],
      "followups": [],
      "witnesses": []
    },
    {
      "id": "c_engine_carry",
      "label": "기관실이 나눠 든다",
      "say": "기관실이 상자를 나눠 들어라. 수레는 쉬게 둔다.",
      "why": "화부들이 삽을 놓고 객차 사이 바람 부는 발판으로 상자를 나른다. \"손수레 일은 저희 몫이 아닙니다.\"",
      "effects": [
        {
          "type": "community.exposure",
          "target": "engine",
          "amount": 4
        },
        {
          "type": "relation",
          "target": "engine",
          "amount": -4
        }
      ],
      "followups": [],
      "witnesses": []
    }
  ],
  "repeat": 0
}
