{
  "id": "ev_b01_lamp_glass",
  "content_type": "event",
  "stage": "s1a",
  "phase": "travel",
  "trigger": [
    {
      "type": "segment",
      "min": 2,
      "max": 20
    }
  ],
  "speaker": "ration_officer",
  "body": "읽던 장부 위로 등의 유리 조각이 떨어졌다. 받침이 느슨해 유리만 깨졌고 기름은 새지 않았다.",
  "choices": [
    {
      "id": "c_replace",
      "label": "등의 유리를 갈아 준다",
      "say": "장부를 옮겨라. 유리를 걷고 새것을 끼운다.",
      "why": "창고 유리는 온실 지붕에 쓰려고 모아 둔 것이다. 한 장이 거기서 나온다.",
      "effects": [
        {
          "type": "luxury",
          "amount": -2
        }
      ],
      "followups": [],
      "witnesses": []
    },
    {
      "id": "c_borrow",
      "label": "앞칸 등을 빌린다",
      "say": "앞칸 등을 이리 가져와라. 장부를 마저 보자.",
      "why": "앞칸 통로가 어두워진다. 장부 한 권 보려고 등을 가져간 것을 지나는 사람들이 본다.",
      "effects": [
        {
          "type": "relation",
          "target": "front",
          "amount": -3
        },
        {
          "type": "trust",
          "amount": -2
        }
      ],
      "followups": [],
      "witnesses": []
    }
  ],
  "repeat": 0
}
