{
  "id": "ev_str_promise",
  "content_type": "event",
  "stage": "s1a",
  "phase": "travel",
  "trigger": [
    {
      "type": "flag",
      "id": "stranded",
      "value": true
    },
    {
      "type": "flag",
      "id": "trip_out",
      "value": true
    }
  ],
  "speaker": "tail",
  "body": "수동차에 오른 사람들이 돌아오면 무엇을 줄 거냐고 대표가 묻는다. 사치품 상자에 둘이 남아 있다.",
  "choices": [
    {
      "id": "c_promise_two",
      "label": "둘을 약속한다",
      "log": "수동차에 오른 사람들에게 사치품 둘을 약속했다.",
      "say": "돌아오면 둘은 그들 것이다.",
      "why": "나간 사람의 칸이 열차장을 다시 본다. 돌아온 날 상자에 둘이 없으면 약속은 빚이 된다.",
      "later": "돌아오는 날 사치품 2를 내준다. 못 주면 신임이 깎인다.",
      "effects": [
        {
          "type": "flag",
          "id": "stranded_promise",
          "value": "yes"
        }
      ],
      "followups": [],
      "witnesses": []
    },
    {
      "id": "c_no_promise",
      "label": "약속하지 않는다",
      "log": "수동차에 오른 사람들에게 아무것도 약속하지 않았다.",
      "say": "돌아오면 그때 본다.",
      "why": "상자는 닫혀 있다. 나간 사람의 칸은 빈손으로 기다린다.",
      "effects": [
        {
          "type": "flag",
          "id": "stranded_promise",
          "value": "no"
        }
      ],
      "followups": [],
      "witnesses": []
    }
  ],
  "repeat": 0
}
