{
  "id": "ev_b01_window_ice",
  "content_type": "event",
  "stage": "s1a",
  "phase": "travel",
  "trigger": [
    {
      "type": "segment",
      "min": 3,
      "max": 20
    },
    {
      "type": "community",
      "community": "front",
      "metric": "warmth",
      "operator": "lte",
      "value": 42
    }
  ],
  "speaker": "front",
  "body": "앞칸 창 안쪽에 두꺼운 얼음이 붙어 틈으로 찬바람이 든다. 창가에서 자던 사람이 젖은 천을 들고 덧댈 것을 찾는다.",
  "choices": [
    {
      "id": "c_patch",
      "label": "창틈을 덧댄다",
      "say": "마른 천을 가져와라. 창틈부터 덧댄다.",
      "why": "마른 천과 못이 창고에서 나가고, 덧대는 동안 창 쪽 난로를 올린다. 찬바람 드는 틈이 막힌다.",
      "effects": [
        {
          "type": "luxury",
          "amount": -3
        },
        {
          "type": "coal",
          "amount": -1
        },
        {
          "type": "community.warmth",
          "target": "front",
          "amount": 5
        }
      ],
      "followups": [],
      "witnesses": []
    },
    {
      "id": "c_engine_cloth",
      "label": "기관실 천을 빌린다",
      "say": "기관실의 마른 천을 내어라. 창틈에 덧댄다.",
      "why": "기관실 마른 천은 화부 숙소 문틈에 끼워 둔 것이다. 빼 오면 그 문틈으로 바람이 든다.",
      "effects": [
        {
          "type": "community.warmth",
          "target": "engine",
          "amount": -4
        },
        {
          "type": "relation",
          "target": "engine",
          "amount": -4
        },
        {
          "type": "community.warmth",
          "target": "front",
          "amount": 4
        }
      ],
      "followups": [],
      "witnesses": []
    }
  ],
  "repeat": 0
}
