{
  "id": "ev_b01_warm_potatoes",
  "content_type": "event",
  "stage": "s1a",
  "phase": "travel",
  "trigger": [
    {
      "type": "segment",
      "min": 2,
      "max": 20
    },
    {
      "type": "flag",
      "id": "ev_achieved",
      "value": true
    }
  ],
  "speaker": "ration_officer",
  "body": "솥 가장자리에 둔 감자가 알맞게 익었다. 배급 담당이 작은 그릇을 내밀며 오늘은 냄새도 먹음직하다고 웃는다.",
  "choices": [
    {
      "id": "c_share",
      "label": "감자를 조금씩 나눈다",
      "log": "솥가의 익은 감자를 조금씩 나누게 했다.",
      "say": "감자를 잘라라. 한 조각씩 맛을 보자.",
      "why": "솥 가장자리 감자 몇 알이 그릇에 나뉜다. 한 조각씩이라 아무도 더 달라고 하지 않는다.",
      "effects": [
        {
          "type": "food",
          "amount": -2
        },
        {
          "type": "tension",
          "amount": -3
        },
        {
          "type": "flag",
          "id": "ev_achieved",
          "value": false
        }
      ],
      "followups": [],
      "witnesses": []
    },
    {
      "id": "c_front_share",
      "label": "앞칸 몫에서 나눈다",
      "log": "익은 감자를 앞칸 몫에서 나누게 했다.",
      "say": "앞칸 감자를 내어라. 그릇을 돌려 보자.",
      "why": "앞칸 솥에서 감자가 나온다. 앞칸은 그릇을 돌리면서도 솥을 건드린 것을 적어 둔다.",
      "later": "앞칸 솥을 건드린 것으로 남아, 앞칸과 한 약속이 있으면 「어긴 말」이 온다.",
      "effects": [
        {
          "type": "community.ration",
          "target": "front",
          "amount": -2
        },
        {
          "type": "relation",
          "target": "front",
          "amount": -3
        },
        {
          "type": "tension",
          "amount": -3
        },
        {
          "type": "flag",
          "id": "front_pot_touched",
          "value": true
        },
        {
          "type": "flag",
          "id": "ev_achieved",
          "value": false
        }
      ],
      "followups": [],
      "witnesses": []
    }
  ],
  "repeat": 0
}
