{
  "id": "ev_h01_low_fire",
  "content_type": "event",
  "stage": "s1a",
  "phase": "travel",
  "trigger": [
    {
      "type": "segment",
      "min": 4,
      "max": 24
    },
    {
      "type": "resource",
      "resource": "coal",
      "operator": "lte",
      "value": 40
    }
  ],
  "speaker": "engine",
  "body": "화부장이 화실 문을 연다. \"이 삽질로는 다음 탑까지 불이 안 갑니다. 어디서든 덜어야 합니다.\"",
  "choices": [
    {
      "id": "c_cut_stoves",
      "label": "뒤쪽 난로를 하나씩 줄인다",
      "log": "화실을 위해 뒤쪽 난로를 낮추게 했다.",
      "say": "뒤쪽 난로부터 불을 낮춰라. 화실이 먼저다.",
      "why": "뒤쪽 난로부터 낮아진다. 꼬리칸은 사람이 제일 많고 난로는 제일 적은 칸이고, 경비칸은 그 옆이다.",
      "effects": [
        {
          "type": "community.warmth",
          "target": "tail",
          "amount": -8
        },
        {
          "type": "community.warmth",
          "target": "guard",
          "amount": -4
        },
        {
          "type": "relation",
          "target": "tail",
          "amount": -5
        }
      ],
      "followups": [],
      "witnesses": []
    },
    {
      "id": "c_slow_down",
      "label": "속도를 줄여 하루 더 간다",
      "log": "불을 아끼려 속도를 줄여 하루 더 가기로 했다.",
      "say": "속도를 줄여라. 하루 더 걸려도 불은 지킨다.",
      "why": "느려진 열차는 석탄을 덜 먹지만 하루치 솥을 더 건다. 창밖을 보는 사람이 는다.",
      "effects": [
        {
          "type": "coal",
          "amount": 3
        },
        {
          "type": "food",
          "amount": -6
        },
        {
          "type": "tension",
          "amount": 2
        }
      ],
      "followups": [],
      "witnesses": []
    },
    {
      "id": "c_burn_furniture",
      "label": "앞칸 가구를 땔감으로 낸다",
      "log": "앞칸 가구를 화실 땔감으로 내게 했다.",
      "say": "앞칸 가구를 내라. 마른 나무부터 화실로 보낸다.",
      "why": "앞칸 탁자와 걸상이 화실로 간다. 앞칸은 자기 살림을 내준 것으로 적어 둔다.",
      "later": "앞칸이 살림을 내준 것으로 기억한다. 겨울 솥 약속을 어긴 것은 아니다.",
      "requires": [
        {
          "type": "resource",
          "resource": "luxury",
          "operator": "gte",
          "value": 3
        }
      ],
      "effects": [
        {
          "type": "coal",
          "amount": 4
        },
        {
          "type": "luxury",
          "amount": -3
        },
        {
          "type": "relation",
          "target": "front",
          "amount": -6
        },
        {
          "type": "flag",
          "id": "front_goods_given",
          "value": true
        }
      ],
      "followups": [],
      "witnesses": []
    }
  ],
  "repeat": 0
}
