{
  "id": "ev_tail_cold_01",
  "stage": "s1a",
  "phase": "travel",
  "trigger": [
    {
      "type": "segment",
      "min": 1,
      "max": 3
    }
  ],
  "speaker": "tail",
  "body": "난로가 꺼졌어요. 우리 칸으로 와 보세요.",
  "choices": [
    {
      "id": "c_share_coal",
      "label": "석탄을 나눈다",
      "why": "꺼진 난로에 석탄을 넣으면 그 칸의 손이 먼저 따뜻해진다.",
      "effects": [
        {
          "type": "coal",
          "amount": -2
        },
        {
          "type": "community.warmth",
          "target": "tail",
          "amount": 1
        }
      ],
      "followups": [],
      "witnesses": [
        "p_001"
      ]
    },
    {
      "id": "c_ask_engine",
      "label": "기관실에 묻는다",
      "why": "묻는 동안 기관실이 답을 정리해 다음 구간에 보낸다.",
      "effects": [
        {
          "type": "flag",
          "id": "heat_requested",
          "value": true
        }
      ],
      "followups": [
        "ev_heat_reply"
      ],
      "witnesses": []
    }
  ],
  "repeat": 0,
  "chronicle": "ch_heat_shared"
}
