{
  "id": "ev_b01_strap_break",
  "content_type": "event",
  "stage": "s1a",
  "phase": "travel",
  "trigger": [
    {
      "type": "segment",
      "min": 3,
      "max": 24
    },
    {
      "type": "flag",
      "id": "b01_strap_pending",
      "value": true
    }
  ],
  "speaker": "engine",
  "body": "매듭을 보탰던 끈이 끊어져 상자가 바닥으로 내려앉았다. 받침 판도 갈라져 짐을 다시 받쳐야 한다.",
  "choices": [
    {
      "id": "c_repair",
      "label": "끈과 받침을 바꾼다",
      "say": "상자를 비워라. 끈과 받침을 함께 바꾼다.",
      "why": "끈 한 타래와 판자가 창고에서 나가고, 상자를 비우고 다시 싣는 동안 열차는 서 있다.",
      "effects": [
        {
          "type": "luxury",
          "amount": -4
        },
        {
          "type": "flag",
          "id": "b01_strap_pending",
          "value": false
        },
        {
          "type": "coal",
          "amount": -2
        }
      ],
      "followups": [],
      "witnesses": []
    },
    {
      "id": "c_front_hold",
      "label": "앞칸에 짐을 나눈다",
      "say": "앞칸이 상자를 나눠 맡아라. 받침은 치운다.",
      "why": "상자 속 짐이 앞칸 침상 밑과 통로로 들어간다. 두 번째 부탁이라 \"이번엔 얼마나입니까\"가 먼저 나온다.",
      "effects": [
        {
          "type": "community.crowding",
          "target": "front",
          "amount": 6
        },
        {
          "type": "relation",
          "target": "front",
          "amount": -5
        },
        {
          "type": "flag",
          "id": "b01_strap_pending",
          "value": false
        }
      ],
      "followups": [],
      "witnesses": []
    }
  ],
  "repeat": 0
}
