{
  "id": "ev_h12_switch_stuck",
  "content_type": "event",
  "stage": "s1a",
  "phase": "travel",
  "trigger": [
    {
      "type": "flag",
      "id": "b01_switch_ignored",
      "value": true
    }
  ],
  "speaker": "engine",
  "body": "그냥 지난 분기기가 반쯤 얼어 굳었다. 기관사가 갈래 틈을 두드린다. \"이제는 날을 갈아 끼워야 움직입니다.\"",
  "choices": [
    {
      "id": "c_new_blade",
      "label": "날을 새로 갈아 끼운다",
      "log": "얼어 굳은 분기기 날을 갈아 끼우게 했다.",
      "say": "날을 새로 갈아라. 이번에는 끝까지 한다.",
      "why": "예비 날 한 짝이 창고에서 나가고, 서 있는 동안 화실이 헛돈다. 지난번엔 끌 한 자루면 됐을 일이다.",
      "requires": [
        {
          "type": "resource",
          "resource": "luxury",
          "operator": "gte",
          "value": 4
        }
      ],
      "effects": [
        {
          "type": "coal",
          "amount": -5
        },
        {
          "type": "luxury",
          "amount": -4
        },
        {
          "type": "flag",
          "id": "b01_switch_ignored",
          "value": false
        },
        {
          "type": "flag",
          "id": "ev_achieved",
          "value": true
        }
      ],
      "followups": [],
      "witnesses": []
    },
    {
      "id": "c_guard_clear2",
      "label": "경비칸에 맡긴다",
      "log": "굳은 분기기 날 교체를 경비칸에 맡겼다.",
      "say": "경비칸이 맡아라. 미룬 값은 내가 기억한다.",
      "why": "들판 바람 속에서 날을 가는 손은 금방 곱는다. \"지난번엔 얼음이었고, 이번엔 쇠다.\"",
      "effects": [
        {
          "type": "community.exposure",
          "target": "guard",
          "amount": 8
        },
        {
          "type": "relation",
          "target": "guard",
          "amount": -6
        },
        {
          "type": "flag",
          "id": "b01_switch_ignored",
          "value": false
        }
      ],
      "followups": [],
      "witnesses": []
    }
  ],
  "repeat": 0
}
