{
  "id": "ev_h08_white_wind",
  "content_type": "event",
  "stage": "s1a",
  "phase": "travel",
  "trigger": [
    {
      "type": "segment",
      "min": 6,
      "max": 24
    }
  ],
  "speaker": "engine",
  "body": "아침부터 낮던 서쪽 하늘에서 바람이 서고, 기관사가 앞유리를 닦는다. \"한 시간 안에 앞이 안 보입니다. 밀고 가면 석탄을 먹고, 숲 그늘에 서면 솥이 빕니다.\"",
  "choices": [
    {
      "id": "c_push_on",
      "label": "밀고 간다",
      "say": "밀고 간다. 불을 더 먹여라.",
      "why": "앞이 안 보이는 길을 밀면 화실이 불을 많이 먹는다. 기관사는 창을 열고 머리를 내밀어 선로를 본다.",
      "effects": [
        {
          "type": "coal",
          "amount": -9
        },
        {
          "type": "community.exposure",
          "target": "engine",
          "amount": 6
        }
      ],
      "followups": [],
      "witnesses": []
    },
    {
      "id": "c_wait_in_woods",
      "label": "숲 그늘에 세워 버틴다",
      "say": "숲 그늘에 세워라. 바람이 지나길 기다린다.",
      "why": "선 동안에도 솥은 건다. 선 열차는 뒤쪽 난방관이 먼저 식어 꼬리칸과 경비칸 창에 성에가 낀다.",
      "effects": [
        {
          "type": "food",
          "amount": -8
        },
        {
          "type": "community.warmth",
          "target": "tail",
          "amount": -4
        },
        {
          "type": "community.warmth",
          "target": "guard",
          "amount": -3
        }
      ],
      "followups": [],
      "witnesses": []
    },
    {
      "id": "c_full_tender",
      "label": "쌓아 둔 석탄으로 밀고 간다",
      "say": "불을 먹여라. 쌓아 둔 것이 오늘 몫이다.",
      "why": "탄수차에 쌓아 둔 것이 오늘 들어간다. 기관사는 잠깐씩만 창을 열고, 뒤쪽 난로엔 그만큼 덜 간다.",
      "requires": [
        {
          "type": "resource",
          "resource": "coal",
          "operator": "gte",
          "value": 60
        }
      ],
      "effects": [
        {
          "type": "coal",
          "amount": -7
        },
        {
          "type": "community.exposure",
          "target": "engine",
          "amount": 3
        },
        {
          "type": "community.warmth",
          "target": "tail",
          "amount": -3
        }
      ],
      "followups": [],
      "witnesses": []
    }
  ],
  "repeat": 0
}
