{
  "id": "ev_h07_quiet_offer",
  "content_type": "event",
  "stage": "s1a",
  "phase": "travel",
  "trigger": [
    {
      "type": "segment",
      "min": 6,
      "max": 16
    },
    {
      "type": "resource",
      "resource": "food",
      "operator": "lte",
      "value": 80
    }
  ],
  "speaker": "rep",
  "community": "front",
  "body": "앞칸 대표가 혼자 찾아와 앉는다. \"다음 회기 표는 드립니다, 안건을 좋아해서가 아닙니다. 이번 겨울 앞칸 솥만 건드리지 말아 주십시오.\"",
  "choices": [
    {
      "id": "c_accept",
      "label": "받는다",
      "say": "알겠다. 앞칸 솥은 건드리지 않겠다.",
      "why": "앞칸 표가 온다. 앞칸 솥을 안 건드리면 모자란 날에 줄어드는 건 꼬리칸 솥이고, 그 칸은 까닭을 모른 채 그릇을 본다.",
      "later": "겨울 끝까지 앞칸 솥을 안 건드리면 「지킨 말」이, 건드리면 「어긴 말」이 온다.",
      "effects": [
        {
          "type": "votes",
          "target": "front",
          "amount": 7,
          "side": "yes"
        },
        {
          "type": "community.ration",
          "target": "tail",
          "amount": -4
        },
        {
          "type": "relation",
          "target": "tail",
          "amount": -5
        },
        {
          "type": "flag",
          "id": "h07_promise",
          "value": true
        },
        {
          "type": "flag",
          "id": "front_pot_touched",
          "value": false
        }
      ],
      "followups": [],
      "witnesses": []
    },
    {
      "id": "c_refuse",
      "label": "거절한다",
      "say": "거절한다. 표로 사지 않겠다.",
      "why": "혼자 와서 한 말이 거절당했다. 앞칸 대표는 모자를 쓰고 나가고, 그 발소리를 통로가 듣는다.",
      "effects": [
        {
          "type": "relation",
          "target": "front",
          "amount": -6
        },
        {
          "type": "tension",
          "amount": 2
        }
      ],
      "followups": [],
      "witnesses": []
    },
    {
      "id": "c_open_session",
      "label": "회기에서 공개한다",
      "say": "회기에서 밝히겠다. 모두가 듣게 하자.",
      "why": "혼자 한 말이 모두 앞에 놓인다. 앞칸은 얼굴을 잃고, 꼬리칸은 자기 솥이 거래에 안 오른 걸 알고, 회기가 시끄럽다.",
      "effects": [
        {
          "type": "trust",
          "amount": 3
        },
        {
          "type": "relation",
          "target": "front",
          "amount": -8
        },
        {
          "type": "relation",
          "target": "tail",
          "amount": 2
        },
        {
          "type": "tension",
          "amount": 4
        },
        {
          "type": "flag",
          "id": "ev_achieved",
          "value": true
        }
      ],
      "followups": [],
      "witnesses": []
    }
  ],
  "repeat": 0
}
