{
  "id": "ev_b01_paper_puppet",
  "content_type": "event",
  "stage": "s1a",
  "phase": "travel",
  "trigger": [
    {
      "type": "segment",
      "min": 3,
      "max": 20
    },
    {
      "type": "flag",
      "id": "ev_achieved",
      "value": true
    }
  ],
  "speaker": "ration_officer",
  "body": "구겨진 종이로 접은 새가 장부 끝에 앉았다. 배급 담당이 새의 부리를 흔들며 자기 몫도 적어 달라고 장난친다.",
  "choices": [
    {
      "id": "c_make",
      "label": "종이 새를 더 접는다",
      "say": "종이를 가져와라. 이 새 옆에 한 마리 더 접자.",
      "why": "장부에 쓸 종이 한 장이 새가 된다. 그릇을 받으며 새를 보고 먼저 웃는 사람이 있다.",
      "effects": [
        {
          "type": "luxury",
          "amount": -2
        },
        {
          "type": "tension",
          "amount": -3
        },
        {
          "type": "flag",
          "id": "ev_achieved",
          "value": false
        }
      ],
      "followups": [],
      "witnesses": []
    },
    {
      "id": "c_front_paper",
      "label": "앞칸 종이를 받는다",
      "say": "앞칸 종이를 내어라. 새 한 마리를 더 접자.",
      "why": "앞칸 종이는 편지지다. 접어 두고 쓸 데가 있던 사람이 말없이 내놓는다.",
      "effects": [
        {
          "type": "relation",
          "target": "front",
          "amount": -3
        },
        {
          "type": "tension",
          "amount": -3
        },
        {
          "type": "flag",
          "id": "ev_achieved",
          "value": false
        }
      ],
      "followups": [],
      "witnesses": []
    }
  ],
  "repeat": 0
}
